{
  "action": {
    "aip_action_ref": "aip-action:0eb8f7faa1bfb183",
    "execution_mode": "delegated",
    "name": "read_source_schema",
    "parameters_hash": "sha256:a383de46a6a697c817f28158eaf13f6a9903233f892d01156274e65d0c6b237e",
    "raw_ref": "raw-action:0eb8f7faa1bfb183",
    "side_effect_class": "read_only",
    "summary": "read_source_schema",
    "tool_ref": "filesystem.read"
  },
  "audit": {
    "decisions": [
      {
        "decision": "preserve_protocol_boundaries",
        "decision_id": "ecl-boundary-001",
        "reason": "ECL references POP, AIP, and ARO fields without redefining their source schemas."
      },
      {
        "decision": "use_openai_agents_trace",
        "decision_id": "ecl-adapter-001",
        "reason": "The source trace shape matched this adapter entrypoint."
      },
      {
        "decision": "hash_canonical_json",
        "decision_id": "ecl-determinism-001",
        "reason": "Every generated ECL record must be reproducible from sorted-key JSON."
      }
    ],
    "source_map": [
      {
        "ecl_path": "$.state.persona_ref",
        "mapping_type": "reference",
        "source_path": "$.id or $.persona_id",
        "source_protocol": "POP"
      },
      {
        "ecl_path": "$.intent",
        "mapping_type": "normalized_copy",
        "source_path": "$.intent and $.constraints",
        "source_protocol": "AIP"
      },
      {
        "ecl_path": "$.action",
        "mapping_type": "normalized_copy",
        "source_path": "$.action and execution metadata",
        "source_protocol": "AIP"
      },
      {
        "ecl_path": "$.evidence",
        "mapping_type": "reference",
        "source_path": "trace events, policy decisions, result references, and receipt/evidence refs",
        "source_protocol": "ARO"
      },
      {
        "ecl_path": "$.evidence.hashes",
        "mapping_type": "derived_hash",
        "source_path": "canonical source trace and ECL record",
        "source_protocol": "ECL"
      }
    ],
    "validation": [
      {
        "report_ref": "out/ecl_artifacts/validator_report.json",
        "status": "not_run",
        "validator": "ecl.validator"
      }
    ]
  },
  "determinism": {
    "adapter_version": "0.1.0",
    "canonicalization": "json-sort-keys-no-whitespace",
    "generated_by": "ecl-execution-compact-layer",
    "hash_algorithm": "sha256"
  },
  "ecl_id": "ecl:1c591e6e8beeb89f",
  "evidence": {
    "aip_result_ref": "aip-result:e98778ff06431639",
    "aro_evidence_ref": "aro-evidence:843cdb942252c236",
    "aro_receipt_ref": "aro-receipt:d4681feafd2548d8",
    "event_chain": [
      {
        "chain_hash": "sha256:f50c3a53e14c461e24f66977c10ec947422019f2e3ac8a5494cb3f14e0c3d927",
        "event_hash": "sha256:c2c451f230fb868040628a2f75337a349cc9cb7805e1088acd8196a93efc8c36",
        "event_id": "span-0001",
        "event_ref": "span-0001",
        "event_type": "tool_call"
      },
      {
        "chain_hash": "sha256:2a70ff8a071c1baa65c7b62fcbdc137346a19ad4499cb077571330d92dcf224e",
        "event_hash": "sha256:45dba0f0a703fd8ed99155c4390589c269ea7820a67176dd4e7ed7eaecf3bf22",
        "event_id": "span-0002",
        "event_ref": "span-0002",
        "event_type": "tool_call"
      }
    ],
    "hashes": {
      "canonical_hash": "sha256:6e9143cb5aa6aaceef6e3355d7c17df265b21f03f96f18a0592bdcbc6ec2d2ea",
      "event_chain_hash": "sha256:f9040d6044bcff860e473aaa22908ffff166f02171b2d7902c3c649dff69dcb8",
      "source_trace_hash": "sha256:f9f8f5dad4ff21956794c4ff2d0df4a97e99b305fd30c166aae858731a628fca"
    },
    "output_refs": [
      "out/ecl_artifacts/ecl_from_openai_agents_trace.json"
    ],
    "policy_decisions": [
      {
        "decision": "allow",
        "decision_ref": "policy-local-only",
        "reason": "Local artifact generation with no external submission."
      },
      {
        "decision": "mapping_incomplete",
        "decision_ref": "adapter-loss-report",
        "loss_report": {
          "complete": false,
          "defaults_used": [
            "reasoning:model_input",
            "tool_call:first_trace_event"
          ],
          "missing_source_fields": [
            "reasoning"
          ],
          "source_trace_hash": "sha256:f9f8f5dad4ff21956794c4ff2d0df4a97e99b305fd30c166aae858731a628fca"
        },
        "reason": "Deterministic OpenAI trace to ECL mapping loss report."
      }
    ],
    "result_status": "completed",
    "result_summary": "ECL schema and local adapter outputs generated",
    "trace_refs": [
      "trace-openai-demo-001"
    ]
  },
  "intent": {
    "aip_intent_ref": "aip-intent:46232b05290487b8",
    "constraints": {
      "external_assumptions": false,
      "structured_outputs_only": true
    },
    "evidence_requirements": {
      "required_outputs": [
        "execution_trace.json",
        "decision_log.json",
        "schema_diff.json",
        "evidence_bundle.json"
      ]
    },
    "expected_result": {
      "artifact_type": "ecl_execution_record"
    },
    "operation": "build_ecl",
    "raw_ref": "raw-intent:f9f8f5dad4ff2195",
    "summary": "Build a deterministic ECL artifact package"
  },
  "lineage": {
    "checkpoint_ref": "sdk://checkpoint",
    "generated_at": "2026-06-28T00:00:00Z",
    "source_adapter": "openai_agents_trace",
    "source_trace_hash": "sha256:f9f8f5dad4ff21956794c4ff2d0df4a97e99b305fd30c166aae858731a628fca",
    "source_trace_ref": "sdk/demo_dependency_mode.py:openai"
  },
  "object_type": "ecl_execution_record",
  "schema_version": "0.1.0-draft",
  "state": {
    "actor_ref": "agent:ecl-builder",
    "correlation_id": "corr-ecl-openai-001",
    "execution_status": "completed",
    "lifecycle_phase": "complete",
    "persona_ref": "persona:mentor:v1",
    "runtime_ref": "openai-agents-sdk"
  }
}
